Sheet: Bell
B2: kappa | C2: Bell
B3: 0.5 | C3: =POLY.BELL(R3C2) -> 1.5 | D3: =RC[-2] -> 0.5
B4: =R[-1]C*R3C2 -> 0.25 | C4: =POLY.BELL(R3C2) -> 1.5 | D4: =R[-1]C[-2]^2+RC[-2] -> 0.5
B5: =R[-1]C*R3C2 -> 0.125 | C5: =POLY.BELL(R3C2) -> 1.5 | D5: ??? | E5: <-- formula for 3rd Bell polynomial
B6: =R[-1]C*R3C2 -> 6.25E-2 | C6: =POLY.BELL(R3C2) -> 1.5 | D6: ??? | E6: <-- formula for 4th Bell polynomial
B7: =R[-1]C*R3C2 -> 3.125E-2 | C7: =POLY.BELL(R3C2) -> 1.5 | D7: ??? | E7: <-- formula for 5th Bell polynomial
B8: =R[-1]C*R3C2 -> 1.5625E-2 | C8: =POLY.BELL(R3C2) -> 1.5
B9: =R[-1]C*R3C2 -> 7.8125E-3 | C9: =POLY.BELL(R3C2) -> 1.5
B10: =R[-1]C*R3C2 -> 3.90625E-3 | C10: =POLY.BELL(R3C2) -> 1.5
B11: =R[-1]C*R3C2 -> 1.953125E-3 | C11: =POLY.BELL(R3C2) -> 1.5
B12: =R[-1]C*R3C2 -> 9.765625E-4 | C12: =POLY.BELL(R3C2) -> 1.5
B13: =R[-1]C*R3C2 -> 4.8828125E-4 | C13: =POLY.BELL(R3C2) -> 1.5
B14: =R[-1]C*R3C2 -> 2.44140625E-4 | C14: =POLY.BELL(R3C2) -> 1.5
B15: =R[-1]C*R3C2 -> 1.220703125E-4 | C15: =POLY.BELL(R3C2) -> 1.5
B16: =R[-1]C*R3C2 -> 6.103515625E-5 | C16: =POLY.BELL(R3C2) -> 1.5
B17: =R[-1]C*R3C2 -> 3.0517578125E-5 | C17: =POLY.BELL(R3C2) -> 1.5
B18: =R[-1]C*R3C2 -> 1.52587890625E-5 | C18: =POLY.BELL(R3C2) -> 1.5
B19: =R[-1]C*R3C2 -> 7.62939453125E-6 | C19: =POLY.BELL(R3C2) -> 1.5
B20: =R[-1]C*R3C2 -> 3.814697265625E-6 | C20: =POLY.BELL(R3C2) -> 1.5

Sheet: Hermite
B2: x\n | C2: H_0 | D2: H_1 | E2: H_2 | F2: H_3 | G2: H_4
B3: -2
B4: -1.9
B5: -1.8
B6: -1.7
B7: -1.6
B8: -1.5
B9: -1.4
B10: -1.3
B11: -1.2
B12: -1.1000000000000001
B13: -1
B14: -0.9
B15: -0.8
B16: -0.7
B17: -0.6
B18: -0.5
B19: -0.4
B20: -0.3
B21: -0.2
B22: -0.1
B23: 0
B24: 0.1
B25: 0.2
B26: 0.3
B27: 0.4
B28: 0.5
B29: 0.6
B30: 0.7
B31: 0.8
B32: 0.9
B33: 1
B34: 1.1000000000000001
B35: 1.2
B36: 1.3
B37: 1.4
B38: 1.5
B39: 1.6
B40: 1.7
B41: 1.8
B42: 1.9
B43: 2