Sheet: Sheet1
B2: f | C2: 100
B3: sigma | C3: 0.2
B4: k | C4: 100 | E4: 0.01 | F4: =BLACK.VALUE(f, RC[-1], k, t) -> 0.19947093241847824 | G4: =BLACK.IMPLIED(f, RC[-1], k, t) -> 1.0000000000000271E-2 | H4: =RC[-3]-RC[-1] -> -2.7061686225238191E-16
B5: t | C5: 0.25 | E5: 0.02 | F5: =BLACK.VALUE(f, RC[-1], k, t) -> 0.39894061814816695 | G5: =BLACK.IMPLIED(f, RC[-1], k, t) -> 1.9999999999999907E-2 | H5: =RC[-3]-RC[-1] -> 9.3675067702747583E-17
C6: =BLACK.VALUE(f, sigma, k, t) -> 3.987761167674492 | E6: 0.03 | F6: =BLACK.VALUE(f, RC[-1], k, t) -> 0.59840781052366765 | G6: =BLACK.IMPLIED(f, RC[-1], k, t) -> 3.0000000000000426E-2 | H6: =RC[-3]-RC[-1] -> -4.2674197509029455E-16
C7: =BLACK.VEGA(f, sigma, k, t) -> 19.922195704738201 | E7: 0.04 | F7: =BLACK.VALUE(f, RC[-1], k, t) -> 0.79787126292632138 | G7: =BLACK.IMPLIED(f, RC[-1], k, t) -> 3.9999999999999772E-2 | H7: =RC[-3]-RC[-1] -> 2.2898349882893854E-16
E8: 0.05 | F8: =BLACK.VALUE(f, RC[-1], k, t) -> 0.99732972880759974 | G8: =BLACK.IMPLIED(f, RC[-1], k, t) -> 5.0000000000000246E-2 | H8: =RC[-3]-RC[-1] -> -2.4286128663675299E-16
E9: 0.06 | F9: =BLACK.VALUE(f, RC[-1], k, t) -> 1.1967819617124462 | G9: =BLACK.IMPLIED(f, RC[-1], k, t) -> 5.9999999999999803E-2 | H9: =RC[-3]-RC[-1] -> 1.9428902930940239E-16
E10: 7.0000000000000007E-2 | F10: =BLACK.VALUE(f, RC[-1], k, t) -> 1.3962267153026957 | G10: =BLACK.IMPLIED(f, RC[-1], k, t) -> 6.9999999999999937E-2 | H10: =RC[-3]-RC[-1] -> 0
E11: 0.08 | F11: =BLACK.VALUE(f, RC[-1], k, t) -> 1.5956627433803945 | G11: =BLACK.IMPLIED(f, RC[-1], k, t) -> 7.9999999999999863E-2 | H11: =RC[-3]-RC[-1] -> 1.3877787807814457E-16
E12: 0.09 | F12: =BLACK.VALUE(f, RC[-1], k, t) -> 1.79508879991117 | G12: =BLACK.IMPLIED(f, RC[-1], k, t) -> 8.9999999999999983E-2 | H12: =RC[-3]-RC[-1] -> 0
E13: 0.1 | F13: =BLACK.VALUE(f, RC[-1], k, t) -> 1.9945036390476076 | G13: =BLACK.IMPLIED(f, RC[-1], k, t) -> 9.9999999999999881E-2 | H13: =RC[-3]-RC[-1] -> 1.2490009027033011E-16
E14: 0.11 | F14: =BLACK.VALUE(f, RC[-1], k, t) -> 2.1939060151525638 | G14: =BLACK.IMPLIED(f, RC[-1], k, t) -> 0.11000000000000024 | H14: =RC[-3]-RC[-1] -> -2.3592239273284576E-16
E15: 0.12 | F15: =BLACK.VALUE(f, RC[-1], k, t) -> 2.3932946828225283 | G15: =BLACK.IMPLIED(f, RC[-1], k, t) -> 0.11999999999999988 | H15: =RC[-3]-RC[-1] -> 1.1102230246251565E-16
E16: 0.13 | F16: =BLACK.VALUE(f, RC[-1], k, t) -> 2.5926683969109732 | G16: =BLACK.IMPLIED(f, RC[-1], k, t) -> 0.12999999999999984 | H16: =RC[-3]-RC[-1] -> 0
E17: 0.14000000000000001 | F17: =BLACK.VALUE(f, RC[-1], k, t) -> 2.792025912551658 | G17: =BLACK.IMPLIED(f, RC[-1], k, t) -> 0.14000000000000001 | H17: =RC[-3]-RC[-1] -> 0
E18: 0.15 | F18: =BLACK.VALUE(f, RC[-1], k, t) -> 2.9913659851819503 | G18: =BLACK.IMPLIED(f, RC[-1], k, t) -> 0.14999999999999977 | H18: =RC[-3]-RC[-1] -> 2.2204460492503131E-16
E19: 0.16 | F19: =BLACK.VALUE(f, RC[-1], k, t) -> 3.1906873705661525 | G19: =BLACK.IMPLIED(f, RC[-1], k, t) -> 0.16000000000000017 | H19: =RC[-3]-RC[-1] -> 0
E20: 0.17 | F20: =BLACK.VALUE(f, RC[-1], k, t) -> 3.3899888248187651 | G20: =BLACK.IMPLIED(f, RC[-1], k, t) -> 0.17000000000000007 | H20: =RC[-3]-RC[-1] -> 0
E21: 0.18 | F21: =BLACK.VALUE(f, RC[-1], k, t) -> 3.5892691044278067 | G21: =BLACK.IMPLIED(f, RC[-1], k, t) -> 0.18000000000000002 | H21: =RC[-3]-RC[-1] -> 0
E22: 0.19 | F22: =BLACK.VALUE(f, RC[-1], k, t) -> 3.7885269662780985 | G22: =BLACK.IMPLIED(f, RC[-1], k, t) -> 0.18999999999999945 | H22: =RC[-3]-RC[-1] -> 5.5511151231257827E-16
E23: 0.2 | F23: =BLACK.VALUE(f, RC[-1], k, t) -> 3.987761167674492 | G23: =BLACK.IMPLIED(f, RC[-1], k, t) -> 0.2 | H23: =RC[-3]-RC[-1] -> 0
E24: 0.21 | F24: =BLACK.VALUE(f, RC[-1], k, t) -> 4.1869704663651319 | G24: =BLACK.IMPLIED(f, RC[-1], k, t) -> 0.21000000000000013 | H24: =RC[-3]-RC[-1] -> 0
E25: 0.22 | F25: =BLACK.VALUE(f, RC[-1], k, t) -> 4.3861536205646985 | G25: =BLACK.IMPLIED(f, RC[-1], k, t) -> 0.21999999999999995 | H25: =RC[-3]-RC[-1] -> 0
E26: 0.23 | F26: =BLACK.VALUE(f, RC[-1], k, t) -> 4.5853093889776417 | G26: =BLACK.IMPLIED(f, RC[-1], k, t) -> 0.23000000000000004 | H26: =RC[-3]-RC[-1] -> 0
E27: 0.24 | F27: =BLACK.VALUE(f, RC[-1], k, t) -> 4.7844365308213668 | G27: =BLACK.IMPLIED(f, RC[-1], k, t) -> 0.23999999999999974 | H27: =RC[-3]-RC[-1] -> 2.4980018054066022E-16
E28: 0.25 | F28: =BLACK.VALUE(f, RC[-1], k, t) -> 4.983533805849433 | G28: =BLACK.IMPLIED(f, RC[-1], k, t) -> 0.2499999999999995 | H28: =RC[-3]-RC[-1] -> 4.9960036108132044E-16
E29: 0.26 | F29: =BLACK.VALUE(f, RC[-1], k, t) -> 5.1825999743747531 | G29: =BLACK.IMPLIED(f, RC[-1], k, t) -> 0.25999999999999984 | H29: =RC[-3]-RC[-1] -> 0
E30: 0.27 | F30: =BLACK.VALUE(f, RC[-1], k, t) -> 5.3816337972926789 | G30: =BLACK.IMPLIED(f, RC[-1], k, t) -> 0.26999999999999985 | H30: =RC[-3]-RC[-1] -> 0
E31: 0.28000000000000003 | F31: =BLACK.VALUE(f, RC[-1], k, t) -> 5.5806340361042288 | G31: =BLACK.IMPLIED(f, RC[-1], k, t) -> 0.28000000000000008 | H31: =RC[-3]-RC[-1] -> 0
E32: 0.28999999999999998 | F32: =BLACK.VALUE(f, RC[-1], k, t) -> 5.7795994529391095 | G32: =BLACK.IMPLIED(f, RC[-1], k, t) -> 0.28999999999999998 | H32: =RC[-3]-RC[-1] -> 0
E33: 0.3 | F33: =BLACK.VALUE(f, RC[-1], k, t) -> 5.9785288105789434 | G33: =BLACK.IMPLIED(f, RC[-1], k, t) -> 0.29999999999999982 | H33: =RC[-3]-RC[-1] -> 0
E34: 0.31 | F34: =BLACK.VALUE(f, RC[-1], k, t) -> 6.1774208724802335 | G34: =BLACK.IMPLIED(f, RC[-1], k, t) -> 0.30999999999999989 | H34: =RC[-3]-RC[-1] -> 0
E35: 0.32 | F35: =BLACK.VALUE(f, RC[-1], k, t) -> 6.3762744027974705 | G35: =BLACK.IMPLIED(f, RC[-1], k, t) -> 0.3199999999999999 | H35: =RC[-3]-RC[-1] -> 0
E36: 0.33 | F36: =BLACK.VALUE(f, RC[-1], k, t) -> 6.5750881664061538 | G36: =BLACK.IMPLIED(f, RC[-1], k, t) -> 0.33000000000000007 | H36: =RC[-3]-RC[-1] -> 0
E37: 0.34 | F37: =BLACK.VALUE(f, RC[-1], k, t) -> 6.7738609289258349 | G37: =BLACK.IMPLIED(f, RC[-1], k, t) -> 0.34 | H37: =RC[-3]-RC[-1] -> 0
E38: 0.35 | F38: =BLACK.VALUE(f, RC[-1], k, t) -> 6.9725914567430749 | G38: =BLACK.IMPLIED(f, RC[-1], k, t) -> 0.35000000000000003 | H38: =RC[-3]-RC[-1] -> 0
E39: 0.36 | F39: =BLACK.VALUE(f, RC[-1], k, t) -> 7.1712785170344233 | G39: =BLACK.IMPLIED(f, RC[-1], k, t) -> 0.36000000000000032 | H39: =RC[-3]-RC[-1] -> 0
E40: 0.37 | F40: =BLACK.VALUE(f, RC[-1], k, t) -> 7.3699208777893759 | G40: =BLACK.IMPLIED(f, RC[-1], k, t) -> 0.37 | H40: =RC[-3]-RC[-1] -> 0
E41: 0.38 | F41: =BLACK.VALUE(f, RC[-1], k, t) -> 7.568517307833261 | G41: =BLACK.IMPLIED(f, RC[-1], k, t) -> 0.37999999999999989 | H41: =RC[-3]-RC[-1] -> 0
E42: 0.39 | F42: =BLACK.VALUE(f, RC[-1], k, t) -> 7.7670665768501834 | G42: =BLACK.IMPLIED(f, RC[-1], k, t) -> 0.39000000000000046 | H42: =RC[-3]-RC[-1] -> -4.4408920985006262E-16
E43: 0.4 | F43: =BLACK.VALUE(f, RC[-1], k, t) -> 7.9655674554058038 | G43: =BLACK.IMPLIED(f, RC[-1], k, t) -> 0.40000000000000041 | H43: =RC[-3]-RC[-1] -> 0
E44: 0.41 | F44: =BLACK.VALUE(f, RC[-1], k, t) -> 8.1640187149702541 | G44: =BLACK.IMPLIED(f, RC[-1], k, t) -> 0.40999999999999975 | H44: =RC[-3]-RC[-1] -> 0
E45: 0.42 | F45: =BLACK.VALUE(f, RC[-1], k, t) -> 8.3624191279409317 | G45: =BLACK.IMPLIED(f, RC[-1], k, t) -> 0.4200000000000001 | H45: =RC[-3]-RC[-1] -> 0
E46: 0.43 | F46: =BLACK.VALUE(f, RC[-1], k, t) -> 8.5607674676652294 | G46: =BLACK.IMPLIED(f, RC[-1], k, t) -> 0.4300000000000001 | H46: =RC[-3]-RC[-1] -> 0
E47: 0.44 | F47: =BLACK.VALUE(f, RC[-1], k, t) -> 8.7590625084633658 | G47: =BLACK.IMPLIED(f, RC[-1], k, t) -> 0.44000000000000017 | H47: =RC[-3]-RC[-1] -> 0
E48: 0.45 | F48: =BLACK.VALUE(f, RC[-1], k, t) -> 8.957303025651008 | G48: =BLACK.IMPLIED(f, RC[-1], k, t) -> 0.45000000000000018 | H48: =RC[-3]-RC[-1] -> 0
E49: 0.46 | F49: =BLACK.VALUE(f, RC[-1], k, t) -> 9.1554877955620455 | G49: =BLACK.IMPLIED(f, RC[-1], k, t) -> 0.45999999999999974 | H49: =RC[-3]-RC[-1] -> 0
E50: 0.47 | F50: =BLACK.VALUE(f, RC[-1], k, t) -> 9.3536155955712417 | G50: =BLACK.IMPLIED(f, RC[-1], k, t) -> 0.47000000000000008 | H50: =RC[-3]-RC[-1] -> 0
E51: 0.48 | F51: =BLACK.VALUE(f, RC[-1], k, t) -> 9.5516852041167724 | G51: =BLACK.IMPLIED(f, RC[-1], k, t) -> 0.47999999999999993 | H51: =RC[-3]-RC[-1] -> 0
E52: 0.49 | F52: =BLACK.VALUE(f, RC[-1], k, t) -> 9.7496954007229277 | G52: =BLACK.IMPLIED(f, RC[-1], k, t) -> 0.49000000000000021 | H52: =RC[-3]-RC[-1] -> 0
E53: 0.5 | F53: =BLACK.VALUE(f, RC[-1], k, t) -> 9.9476449660225796 | G53: =BLACK.IMPLIED(f, RC[-1], k, t) -> 0.50000000000000044 | H53: =RC[-3]-RC[-1] -> 0
E54: 0.51 | F54: =BLACK.VALUE(f, RC[-1], k, t) -> 10.145532681779784 | G54: =BLACK.IMPLIED(f, RC[-1], k, t) -> 0.50999999999999934 | H54: =RC[-3]-RC[-1] -> 0
E55: 0.52 | F55: =BLACK.VALUE(f, RC[-1], k, t) -> 10.343357330912227 | G55: =BLACK.IMPLIED(f, RC[-1], k, t) -> 0.52000000000000024 | H55: =RC[-3]-RC[-1] -> 0
E56: 0.53 | F56: =BLACK.VALUE(f, RC[-1], k, t) -> 10.541117697513648 | G56: =BLACK.IMPLIED(f, RC[-1], k, t) -> 0.5299999999999998 | H56: =RC[-3]-RC[-1] -> 0
E57: 0.54 | F57: =BLACK.VALUE(f, RC[-1], k, t) -> 10.738812566876348 | G57: =BLACK.IMPLIED(f, RC[-1], k, t) -> 0.54000000000000081 | H57: =RC[-3]-RC[-1] -> 0
E58: 0.55000000000000004 | F58: =BLACK.VALUE(f, RC[-1], k, t) -> 10.936440725513435 | G58: =BLACK.IMPLIED(f, RC[-1], k, t) -> 0.5500000000000006 | H58: =RC[-3]-RC[-1] -> 0
E59: 0.56000000000000005 | F59: =BLACK.VALUE(f, RC[-1], k, t) -> 11.134000961181286 | G59: =BLACK.IMPLIED(f, RC[-1], k, t) -> 0.55999999999999983 | H59: =RC[-3]-RC[-1] -> 0
E60: 0.56999999999999995 | F60: =BLACK.VALUE(f, RC[-1], k, t) -> 11.331492062901823 | G60: =BLACK.IMPLIED(f, RC[-1], k, t) -> 0.57000000000000028 | H60: =RC[-3]-RC[-1] -> 0
E61: 0.57999999999999996 | F61: =BLACK.VALUE(f, RC[-1], k, t) -> 11.528912820984694 | G61: =BLACK.IMPLIED(f, RC[-1], k, t) -> 0.57999999999999985 | H61: =RC[-3]-RC[-1] -> 0
E62: 0.59 | F62: =BLACK.VALUE(f, RC[-1], k, t) -> 11.726262027049629 | G62: =BLACK.IMPLIED(f, RC[-1], k, t) -> 0.58999999999999975 | H62: =RC[-3]-RC[-1] -> 0
E63: 0.6 | F63: =BLACK.VALUE(f, RC[-1], k, t) -> 11.923538474048499 | G63: =BLACK.IMPLIED(f, RC[-1], k, t) -> 0.6 | H63: =RC[-3]-RC[-1] -> 0
E64: 0.61 | F64: =BLACK.VALUE(f, RC[-1], k, t) -> 12.12074095628752 | G64: =BLACK.IMPLIED(f, RC[-1], k, t) -> 0.60999999999999976 | H64: =RC[-3]-RC[-1] -> 0
E65: 0.62 | F65: =BLACK.VALUE(f, RC[-1], k, t) -> 12.31786826944937 | G65: =BLACK.IMPLIED(f, RC[-1], k, t) -> 0.62 | H65: =RC[-3]-RC[-1] -> 0
E66: 0.63 | F66: =BLACK.VALUE(f, RC[-1], k, t) -> 12.514919210615169 | G66: =BLACK.IMPLIED(f, RC[-1], k, t) -> 0.63000000000000012 | H66: =RC[-3]-RC[-1] -> 0
E67: 0.64 | F67: =BLACK.VALUE(f, RC[-1], k, t) -> 12.711892578286573 | G67: =BLACK.IMPLIED(f, RC[-1], k, t) -> 0.6399999999999999 | H67: =RC[-3]-RC[-1] -> 0
E68: 0.65 | F68: =BLACK.VALUE(f, RC[-1], k, t) -> 12.908787172407685 | G68: =BLACK.IMPLIED(f, RC[-1], k, t) -> 0.65000000000000036 | H68: =RC[-3]-RC[-1] -> 0
E69: 0.66 | F69: =BLACK.VALUE(f, RC[-1], k, t) -> 13.105601794387034 | G69: =BLACK.IMPLIED(f, RC[-1], k, t) -> 0.65999999999999992 | H69: =RC[-3]-RC[-1] -> 0
E70: 0.67 | F70: =BLACK.VALUE(f, RC[-1], k, t) -> 13.302335247119409 | G70: =BLACK.IMPLIED(f, RC[-1], k, t) -> 0.67 | H70: =RC[-3]-RC[-1] -> 0
E71: 0.68 | F71: =BLACK.VALUE(f, RC[-1], k, t) -> 13.498986335007686 | G71: =BLACK.IMPLIED(f, RC[-1], k, t) -> 0.6799999999999996 | H71: =RC[-3]-RC[-1] -> 0
E72: 0.69 | F72: =BLACK.VALUE(f, RC[-1], k, t) -> 13.695553863984649 | G72: =BLACK.IMPLIED(f, RC[-1], k, t) -> 0.6899999999999995 | H72: =RC[-3]-RC[-1] -> 0
E73: 0.7 | F73: =BLACK.VALUE(f, RC[-1], k, t) -> 13.89203664153473 | G73: =BLACK.IMPLIED(f, RC[-1], k, t) -> 0.69999999999999962 | H73: =RC[-3]-RC[-1] -> 0
E74: 0.71 | F74: =BLACK.VALUE(f, RC[-1], k, t) -> 14.088433476715664 | G74: =BLACK.IMPLIED(f, RC[-1], k, t) -> 0.7100000000000003 | H74: =RC[-3]-RC[-1] -> 0
E75: 0.72 | F75: =BLACK.VALUE(f, RC[-1], k, t) -> 14.284743180180143 | G75: =BLACK.IMPLIED(f, RC[-1], k, t) -> 0.72 | H75: =RC[-3]-RC[-1] -> 0
E76: 0.73 | F76: =BLACK.VALUE(f, RC[-1], k, t) -> 14.480964564197436 | G76: =BLACK.IMPLIED(f, RC[-1], k, t) -> 0.73000000000000043 | H76: =RC[-3]-RC[-1] -> 0
E77: 0.74 | F77: =BLACK.VALUE(f, RC[-1], k, t) -> 14.67709644267488 | G77: =BLACK.IMPLIED(f, RC[-1], k, t) -> 0.74000000000000044 | H77: =RC[-3]-RC[-1] -> 0
E78: 0.75 | F78: =BLACK.VALUE(f, RC[-1], k, t) -> 14.873137631179432 | G78: =BLACK.IMPLIED(f, RC[-1], k, t) -> 0.74999999999999978 | H78: =RC[-3]-RC[-1] -> 0
E79: 0.76 | F79: =BLACK.VALUE(f, RC[-1], k, t) -> 15.069086946959104 | G79: =BLACK.IMPLIED(f, RC[-1], k, t) -> 0.76000000000000012 | H79: =RC[-3]-RC[-1] -> 0
E80: 0.77 | F80: =BLACK.VALUE(f, RC[-1], k, t) -> 15.264943208964226 | G80: =BLACK.IMPLIED(f, RC[-1], k, t) -> 0.76999999999999946 | H80: =RC[-3]-RC[-1] -> 0
E81: 0.78 | F81: =BLACK.VALUE(f, RC[-1], k, t) -> 15.460705237869021 | G81: =BLACK.IMPLIED(f, RC[-1], k, t) -> 0.7799999999999998 | H81: =RC[-3]-RC[-1] -> 0
E82: 0.79 | F82: =BLACK.VALUE(f, RC[-1], k, t) -> 15.656371856092647 | G82: =BLACK.IMPLIED(f, RC[-1], k, t) -> 0.7899999999999997 | H82: =RC[-3]-RC[-1] -> 0
E83: 0.8 | F83: =BLACK.VALUE(f, RC[-1], k, t) -> 15.851941887820608 | G83: =BLACK.IMPLIED(f, RC[-1], k, t) -> 0.80000000000000038 | H83: =RC[-3]-RC[-1] -> 0
E84: 0.81 | F84: =BLACK.VALUE(f, RC[-1], k, t) -> 16.047414159025777 | G84: =BLACK.IMPLIED(f, RC[-1], k, t) -> 0.8100000000000005 | H84: =RC[-3]-RC[-1] -> 0
E85: 0.82 | F85: =BLACK.VALUE(f, RC[-1], k, t) -> 16.242787497489623 | G85: =BLACK.IMPLIED(f, RC[-1], k, t) -> 0.81999999999999951 | H85: =RC[-3]-RC[-1] -> 0
E86: 0.83 | F86: =BLACK.VALUE(f, RC[-1], k, t) -> 16.438060732823274 | G86: =BLACK.IMPLIED(f, RC[-1], k, t) -> 0.82999999999999929 | H86: =RC[-3]-RC[-1] -> 0
E87: 0.84 | F87: =BLACK.VALUE(f, RC[-1], k, t) -> 16.633232696488463 | G87: =BLACK.IMPLIED(f, RC[-1], k, t) -> 0.84000000000000019 | H87: =RC[-3]-RC[-1] -> 0
E88: 0.85 | F88: =BLACK.VALUE(f, RC[-1], k, t) -> 16.828302221818475 | G88: =BLACK.IMPLIED(f, RC[-1], k, t) -> 0.8499999999999992 | H88: =RC[-3]-RC[-1] -> 0
E89: 0.86 | F89: =BLACK.VALUE(f, RC[-1], k, t) -> 17.023268144039157 | G89: =BLACK.IMPLIED(f, RC[-1], k, t) -> 0.86 | H89: =RC[-3]-RC[-1] -> 0
E90: 0.87 | F90: =BLACK.VALUE(f, RC[-1], k, t) -> 17.218129300289561 | G90: =BLACK.IMPLIED(f, RC[-1], k, t) -> 0.87000000000000044 | H90: =RC[-3]-RC[-1] -> 0
E91: 0.88 | F91: =BLACK.VALUE(f, RC[-1], k, t) -> 17.412884529642916 | G91: =BLACK.IMPLIED(f, RC[-1], k, t) -> 0.88000000000000012 | H91: =RC[-3]-RC[-1] -> 0
E92: 0.89 | F92: =BLACK.VALUE(f, RC[-1], k, t) -> 17.607532673127224 | G92: =BLACK.IMPLIED(f, RC[-1], k, t) -> 0.8899999999999999 | H92: =RC[-3]-RC[-1] -> 0
E93: 0.9 | F93: =BLACK.VALUE(f, RC[-1], k, t) -> 17.802072573745924 | G93: =BLACK.IMPLIED(f, RC[-1], k, t) -> 0.90000000000000013 | H93: =RC[-3]-RC[-1] -> 0
E94: 0.91 | F94: =BLACK.VALUE(f, RC[-1], k, t) -> 17.996503076498541 | G94: =BLACK.IMPLIED(f, RC[-1], k, t) -> 0.90999999999999959 | H94: =RC[-3]-RC[-1] -> 0
E95: 0.92 | F95: =BLACK.VALUE(f, RC[-1], k, t) -> 18.190823028401176 | G95: =BLACK.IMPLIED(f, RC[-1], k, t) -> 0.91999999999999993 | H95: =RC[-3]-RC[-1] -> 0
E96: 0.93 | F96: =BLACK.VALUE(f, RC[-1], k, t) -> 18.385031278506986 | G96: =BLACK.IMPLIED(f, RC[-1], k, t) -> 0.93000000000000049 | H96: =RC[-3]-RC[-1] -> 0
E97: 0.94 | F97: =BLACK.VALUE(f, RC[-1], k, t) -> 18.57912667792661 | G97: =BLACK.IMPLIED(f, RC[-1], k, t) -> 0.9400000000000005 | H97: =RC[-3]-RC[-1] -> 0
E98: 0.95 | F98: =BLACK.VALUE(f, RC[-1], k, t) -> 18.773108079848484 | G98: =BLACK.IMPLIED(f, RC[-1], k, t) -> 0.95000000000000018 | H98: =RC[-3]-RC[-1] -> 0
E99: 0.96 | F99: =BLACK.VALUE(f, RC[-1], k, t) -> 18.966974339559158 | G99: =BLACK.IMPLIED(f, RC[-1], k, t) -> 0.95999999999999985 | H99: =RC[-3]-RC[-1] -> 0
E100: 0.97 | F100: =BLACK.VALUE(f, RC[-1], k, t) -> 19.160724314463522 | G100: =BLACK.IMPLIED(f, RC[-1], k, t) -> 0.96999999999999964 | H100: =RC[-3]-RC[-1] -> 0
E101: 0.98 | F101: =BLACK.VALUE(f, RC[-1], k, t) -> 19.354356864104879 | G101: =BLACK.IMPLIED(f, RC[-1], k, t) -> 0.9800000000000002 | H101: =RC[-3]-RC[-1] -> 0
E102: 0.99 | F102: =BLACK.VALUE(f, RC[-1], k, t) -> 19.54787085018512 | G102: =BLACK.IMPLIED(f, RC[-1], k, t) -> 0.98999999999999977 | H102: =RC[-3]-RC[-1] -> 0
E103: 1 | F103: =BLACK.VALUE(f, RC[-1], k, t) -> 19.741265136584744 | G103: =BLACK.IMPLIED(f, RC[-1], k, t) -> 0.99999999999999989 | H103: =RC[-3]-RC[-1] -> 0